<?xml version="1.0" encoding="UTF-8"?>
<xs:schema xmlns:xs="http://www.w3.org/2001/XMLSchema">
    <xs:include schemaLocation="capability.xsd"/>
    <xs:element name="DeviceCapabilities">
        <xs:complexType>
            <xs:sequence>
                    <xs:element name="Capability" type="capability" maxOccurs="unbounded" minOccurs="0"/>
            </xs:sequence>
        </xs:complexType>
    </xs:element>
</xs:schema>
